Ticker,Title,URL,Published,Summary,Sentiment,Score,FetchedAt
MSFT,"Microsoft Doesn't Need To Win The AI Race, It Needs The AI Race To Be Brutal",https://seekingalpha.com/article/4897835-microsoft-doesnt-need-to-win-the-ai-race-it-needs-ai-race-to-be-brutal?source=feed_symbol_MSFT,"Sun, 03 May 2026 06:43:40 -0400","Microsoft Doesn't Need To Win The AI Race, It Needs The AI Race To Be Brutal",neutral,50.0,2026-05-03T11:11:19.594567
MSFT,Microsoft Corporation 2026 Q3 - Results - Earnings Call Presentation,https://seekingalpha.com/article/4897782-microsoft-corporation-2026-q3-results-earnings-call-presentation?source=feed_symbol_MSFT,"Sat, 02 May 2026 19:10:31 -0400",Microsoft Corporation 2026 Q3 - Results - Earnings Call Presentation,neutral,50.0,2026-05-02T23:40:17.655539
MSFT,Microsoft: Underdog Cloud Player With Serious Upside,https://seekingalpha.com/article/4897574-microsoft-underdog-cloud-player-with-serious-upside?source=feed_symbol_MSFT,"Fri, 01 May 2026 14:37:16 -0400",Microsoft: Underdog Cloud Player With Serious Upside,neutral,50.0,2026-05-01T19:40:20.094382
MSFT,Microsoft: This Sell-Off Doesn't Make Any Sense,https://seekingalpha.com/article/4897372-microsoft-sell-off-does-not-make-any-sense?source=feed_symbol_MSFT,"Fri, 01 May 2026 09:42:09 -0400",Microsoft: This Sell-Off Doesn't Make Any Sense,neutral,50.0,2026-05-01T14:06:35.679508
MSFT,Microsoft Q3: Turning Market Skepticism Into Opportunity,https://seekingalpha.com/article/4896977-microsoft-q3-turning-market-skepticism-into-opportunity?source=feed_symbol_MSFT,"Thu, 30 Apr 2026 16:32:38 -0400",Microsoft Q3: Turning Market Skepticism Into Opportunity,neutral,50.0,2026-04-30T20:58:09.883611
MSFT,Microsoft: AI Paradigm Shift Is Imminent,https://seekingalpha.com/article/4896804-microsoft-ai-paradigm-shift-is-imminent?source=feed_symbol_MSFT,"Thu, 30 Apr 2026 13:14:08 -0400",Microsoft: AI Paradigm Shift Is Imminent,neutral,50.0,2026-04-30T18:08:50.855687
MSFT,Microsoft's AI Engine Just Switched Gears,https://seekingalpha.com/article/4896452-microsoft-stock-q3-ai-engine-just-switched-gears?source=feed_symbol_MSFT,"Thu, 30 Apr 2026 11:15:19 -0400",Microsoft's AI Engine Just Switched Gears,neutral,50.0,2026-04-30T15:22:30.104260
MSFT,"Microsoft: Everyone Sees CapEx, Few See The Strength In AI Growth",https://seekingalpha.com/article/4896586-microsoft-everyone-sees-capex-few-see-the-strength-in-ai-growth?source=feed_symbol_MSFT,"Thu, 30 Apr 2026 09:58:02 -0400","Microsoft: Everyone Sees CapEx, Few See The Strength In AI Growth",neutral,50.0,2026-04-30T15:22:34.319625
MSFT,"Microsoft Q3: $190B CapEx Looks Scary, But 40% Azure Growth Says Otherwise",https://seekingalpha.com/article/4896541-microsoft-q3-190b-capex-looks-scary-but-40-percent-azure-growth-says-otherwise?source=feed_symbol_MSFT,"Thu, 30 Apr 2026 09:15:00 -0400","Microsoft Q3: $190B CapEx Looks Scary, But 40% Azure Growth Says Otherwise",neutral,50.0,2026-04-30T15:22:38.904473
MSFT,"Microsoft Q3: 30% Discount Happens Rarely, I'm Buying",https://seekingalpha.com/article/4896540-microsoft-q3-30-percent-discount-happens-rarely-im-buying?source=feed_symbol_MSFT,"Thu, 30 Apr 2026 09:00:49 -0400",The author is purchasing Microsoft Q3 due to a rare 30% discount.,positive,95.0,2026-04-30T13:04:47.517809
MSFT,Microsoft: The Best AI Bet Post Earnings,https://seekingalpha.com/article/4896571-microsoft-the-best-ai-bet-post-earnings?source=feed_symbol_MSFT,"Thu, 30 Apr 2026 08:45:26 -0400",Microsoft: The Best AI Bet Post Earnings,neutral,50.0,2026-04-30T13:04:57.507836
MSFT,Microsoft Corporation (MSFT) Q3 2026 Earnings Call Transcript,https://seekingalpha.com/article/4896208-microsoft-corporation-msft-q3-2026-earnings-call-transcript?source=feed_symbol_MSFT,"Wed, 29 Apr 2026 22:31:32 -0400",Microsoft Corporation (MSFT) Q3 2026 Earnings Call Transcript,neutral,50.0,2026-04-30T04:54:11.417478
MSFT,Microsoft: Buy This Bargain Before Earnings,https://seekingalpha.com/article/4894933-microsoft-buy-this-bargain-before-earnings?source=feed_symbol_MSFT,"Tue, 28 Apr 2026 07:39:52 -0400",Microsoft: Buy This Bargain Before Earnings,neutral,50.0,2026-04-28T13:11:08.773496
MSFT,Wall Street Lunch: OpenAI Loosens Exclusivity In Revised Microsoft Pact,https://seekingalpha.com/article/4894660-wall-street-lunch-openai-loosens-exclusivity-in-revised-microsoft-pact?source=feed_symbol_MSFT,"Mon, 27 Apr 2026 13:07:32 -0400",Wall Street Lunch: OpenAI Loosens Exclusivity In Revised Microsoft Pact,neutral,50.0,2026-04-27T18:20:39.098195
MSFT,Microsoft: Preparing For Pivotal 'Show-Me' Q3 Earnings,https://seekingalpha.com/article/4894429-microsoft-preparing-for-pivotal-show-me-q3-earnings?source=feed_symbol_MSFT,"Sun, 26 Apr 2026 11:29:55 -0400",Microsoft: Preparing For Pivotal 'Show-Me' Q3 Earnings,neutral,50.0,2026-04-26T17:07:49.510890
MSFT,Microsoft Q3 Preview: Why I See Upside Ahead,https://seekingalpha.com/article/4894405-microsoft-q3-preview-why-i-see-upside-ahead?source=feed_symbol_MSFT,"Sun, 26 Apr 2026 09:15:00 -0400",Microsoft Q3 Preview: Why I See Upside Ahead,neutral,50.0,2026-04-26T14:33:27.957788
MSFT,Microsoft: The Voluntary Buyout Is A Warning Shot Before Earnings,https://seekingalpha.com/article/4894021-microsoft-the-voluntary-buyout-is-a-warning-shot-before-earnings?source=feed_symbol_MSFT,"Fri, 24 Apr 2026 11:55:49 -0400",Microsoft: The Voluntary Buyout Is A Warning Shot Before Earnings,neutral,50.0,2026-04-24T17:57:36.733089
MSFT,"Microsoft Is A Value Trap, OpenAI Dependence Could Backfire",https://seekingalpha.com/article/4893897-microsoft-is-a-value-trap-openai-dependence-could-backfire?source=feed_symbol_MSFT,"Fri, 24 Apr 2026 08:06:31 -0400","Microsoft Is A Value Trap, OpenAI Dependence Could Backfire",neutral,50.0,2026-04-24T14:59:09.556854
MSFT,Microsoft: The Dumbest Sell-Off In Big Tech,https://seekingalpha.com/article/4893135-microsoft-the-dumbest-sell-off-in-big-tech?source=feed_symbol_MSFT,"Thu, 23 Apr 2026 09:15:00 -0400",Microsoft: The Dumbest Sell-Off In Big Tech,neutral,50.0,2026-04-23T16:54:07.879771
MSFT,Microsoft Stock Is Cheap Into Earnings,https://seekingalpha.com/article/4893162-microsoft-stock-is-cheap-into-q3-earnigns?source=feed_symbol_MSFT,"Thu, 23 Apr 2026 07:45:00 -0400",Microsoft stock is currently considered cheap ahead of its earnings report.,positive,80.0,2026-04-23T16:54:09.539943
MSFT,Microsoft Q3 Preview: This Earnings Print Could Change Everything,https://seekingalpha.com/article/4893309-microsoft-q3-preview-this-earnings-print-could-change-everything?source=feed_symbol_MSFT,"Thu, 23 Apr 2026 07:43:05 -0400",Microsoft Q3 Preview: This Earnings Print Could Change Everything,neutral,50.0,2026-04-23T16:54:11.313578
MSFT,Microsoft's Bear Case Is Hard To Buy,https://seekingalpha.com/article/4892256-microsofts-bear-case-is-hard-to-buy?source=feed_symbol_MSFT,"Tue, 21 Apr 2026 05:26:24 -0400",Microsoft's Bear Case Is Hard To Buy,neutral,50.0,2026-04-21T10:51:34.214374
MSFT,"Microsoft: Don't Buy The Dip, A 30% Correction Is Still Ahead",https://seekingalpha.com/article/4891641-microsoft-don-t-buy-the-dip-a-30-percent-correction-is-still-ahead?source=feed_symbol_MSFT,"Fri, 17 Apr 2026 13:22:03 -0400","Microsoft: Don't Buy The Dip, A 30% Correction Is Still Ahead",neutral,50.0,2026-04-17T17:35:59.227950
MSFT,Microsoft: Not Like Meta In 2022,https://seekingalpha.com/article/4891618-microsoft-not-like-meta-in-2022?source=feed_symbol_MSFT,"Fri, 17 Apr 2026 12:15:22 -0400",Microsoft: Not Like Meta In 2022,neutral,50.0,2026-04-17T17:36:00.855693
MSFT,Microsoft: Cheap For All The Wrong Reasons,https://seekingalpha.com/article/4891317-microsoft-cheap-for-all-the-wrong-reasons?source=feed_symbol_MSFT,"Thu, 16 Apr 2026 12:48:39 -0400",Microsoft: Cheap For All The Wrong Reasons,neutral,50.0,2026-04-16T19:52:47.780358
MSFT,Microsoft: Claude Just Threatened Copilot Adoption,https://seekingalpha.com/article/4891151-microsoft-claude-just-threatened-copilot-adoption?source=feed_symbol_MSFT,"Thu, 16 Apr 2026 05:54:23 -0400",Microsoft: Claude Just Threatened Copilot Adoption,neutral,50.0,2026-04-16T10:47:15.034994
MSFT,Microsoft: The New Standard Oil - Why 'Intelligence Refinery' Is Future Of Global Profit,https://seekingalpha.com/article/4891130-microsoft-new-standard-oil-why-intelligence-refinery-is-future-of-global-profit?source=feed_symbol_MSFT,"Thu, 16 Apr 2026 04:56:47 -0400",Microsoft: The New Standard Oil - Why 'Intelligence Refinery' Is Future Of Global Profit,neutral,50.0,2026-04-16T10:47:16.567849
MSFT,Microsoft: Mispriced And Unfairly Tarnished With Overblown Capital Allocation Fears (Rating Upgrade),https://seekingalpha.com/article/4890907-microsoft-mispriced-and-unfairly-tarnished-with-overblown-capital-allocation-fears-rating-upgrade?source=feed_symbol_MSFT,"Wed, 15 Apr 2026 11:06:56 -0400",Microsoft: Mispriced And Unfairly Tarnished With Overblown Capital Allocation Fears (Rating Upgrade),neutral,50.0,2026-04-15T18:50:15.756693
MSFT,Microsoft: CAPEX Spending In Focus Ahead Of Q3,https://seekingalpha.com/article/4890658-microsoft-capex-spending-in-focus-ahead-of-q3?source=feed_symbol_MSFT,"Tue, 14 Apr 2026 14:43:54 -0400",Microsoft: CAPEX Spending In Focus Ahead Of Q3,neutral,50.0,2026-04-14T19:55:50.750899
MSFT,"Microsoft: Azure Is Booming, But OpenAI And Copilot Are Quietly Capping The Upside",https://seekingalpha.com/article/4890043-microsoft-azure-is-booming-but-openai-and-copilot-are-quietly-capping-the-upside?source=feed_symbol_MSFT,"Sun, 12 Apr 2026 02:00:14 -0400","Microsoft: Azure Is Booming, But OpenAI And Copilot Are Quietly Capping The Upside",neutral,50.0,2026-04-12T06:11:47.810640
MSFT,Microsoft: Temporary CapEx Panic Masks The Long-Term Edge,https://seekingalpha.com/article/4889744-microsoft-stock-temporary-capex-panic-masks-the-long-term-edge?source=feed_symbol_MSFT,"Fri, 10 Apr 2026 05:40:44 -0400",Microsoft: Temporary CapEx Panic Masks The Long-Term Edge,neutral,50.0,2026-04-10T10:17:54.727325
MSFT,Microsoft: The Selloff Looks Better Than The Story,https://seekingalpha.com/article/4889520-microsoft-the-selloff-looks-better-than-the-story?source=feed_symbol_MSFT,"Thu, 09 Apr 2026 10:35:15 -0400",Microsoft: The Selloff Looks Better Than The Story,neutral,50.0,2026-04-09T16:06:38.523915
MSFT,Microsoft: Buy The AI Empire,https://seekingalpha.com/article/4889280-microsoft-buy-the-ai-empire?source=feed_symbol_MSFT,"Wed, 08 Apr 2026 13:02:07 -0400",Microsoft: Buy The AI Empire,neutral,50.0,2026-04-08T18:56:54.525903
MSFT,Option Activity In Microsoft Points To Higher Prices (Technical Analysis),https://seekingalpha.com/article/4889205-option-activity-in-microsoft-points-to-higher-prices-technical-analysis?source=feed_symbol_MSFT,"Wed, 08 Apr 2026 09:50:10 -0400",Option Activity In Microsoft Points To Higher Prices (Technical Analysis),neutral,50.0,2026-04-08T14:58:54.503660
MSFT,Microsoft: The Market Is Forcing Me To Buy This Bargain (Rating Upgrade),https://seekingalpha.com/article/4889128-microsoft-market-is-forcing-me-to-buy-this-bargain-rating-upgrade?source=feed_symbol_MSFT,"Wed, 08 Apr 2026 04:08:49 -0400",Microsoft: The Market Is Forcing Me To Buy This Bargain (Rating Upgrade),neutral,50.0,2026-04-08T10:16:59.875632
MSFT,"Microsoft: Unloved, Not Broken",https://seekingalpha.com/article/4888912-microsoft-unloved-not-broken?source=feed_symbol_MSFT,"Tue, 07 Apr 2026 09:44:14 -0400","Microsoft: Unloved, Not Broken",neutral,50.0,2026-04-07T16:18:27.359543
MSFT,Microsoft: Anthropic's $30 Billion ARR Says A Lot (Rating Downgrade),https://seekingalpha.com/article/4888885-microsoft-anthropic-30-billion-arr-says-lot-rating-downgrade?source=feed_symbol_MSFT,"Tue, 07 Apr 2026 08:30:12 -0400",Microsoft: Anthropic's $30 Billion ARR Says A Lot (Rating Downgrade),neutral,50.0,2026-04-07T16:18:29.063394
MSFT,Microsoft: Double-Digit Growth At A Rare Discount,https://seekingalpha.com/article/4888643-microsoft-double-digit-growth-at-a-rare-discount?source=feed_symbol_MSFT,"Mon, 06 Apr 2026 10:52:36 -0400","Microsoft is experiencing strong double-digit growth, which is currently available at a rare discount.",positive,90.0,2026-04-06T17:12:03.426467
MSFT,Microsoft's Selloff Is Hiding A Bigger Opportunity,https://seekingalpha.com/article/4888411-microsofts-selloff-is-hiding-a-bigger-opportunity?source=feed_symbol_MSFT,"Sat, 04 Apr 2026 10:16:36 -0400",Microsoft's Selloff Is Hiding A Bigger Opportunity,neutral,50.0,2026-04-04T15:49:49.934492
MSFT,Microsoft And Its Real Value,https://seekingalpha.com/article/4888383-microsoft-and-its-real-value?source=feed_symbol_MSFT,"Sat, 04 Apr 2026 06:18:01 -0400",Microsoft And Its Real Value,neutral,50.0,2026-04-04T11:04:54.464563
MSFT,Microsoft Has A Visibility Problem; I'd Rather Wait,https://seekingalpha.com/article/4888375-microsoft-has-a-visibility-problem-id-rather-wait?source=feed_symbol_MSFT,"Sat, 04 Apr 2026 05:13:45 -0400",Microsoft Has A Visibility Problem; I'd Rather Wait,neutral,50.0,2026-04-04T09:57:25.619704
MSFT,Microsoft Is 11% Of My NAV And I'm Targeting Monster Returns,https://seekingalpha.com/article/4888209-microsoft-is-11-percent-of-my-nav-and-im-targeting-monster-returns?source=feed_symbol_MSFT,"Thu, 02 Apr 2026 18:44:01 -0400",Microsoft Is 11% Of My NAV And I'm Targeting Monster Returns,neutral,50.0,2026-04-02T23:54:14.993499
MSFT,Microsoft's AI Reset Created A Rare Bargain,https://seekingalpha.com/article/4888013-microsofts-ai-reset-created-a-rare-bargain?source=feed_symbol_MSFT,"Thu, 02 Apr 2026 01:26:12 -0400",Microsoft's AI Reset Created A Rare Bargain,neutral,50.0,2026-04-02T05:52:42.228889
MSFT,Microsoft: A Gift At 22x P/E (Rating Upgrade),https://seekingalpha.com/article/4887895-microsoft-a-gift-at-22x-pe-rating-upgrade?source=feed_symbol_MSFT,"Wed, 01 Apr 2026 13:32:05 -0400",Microsoft: A Gift At 22x P/E (Rating Upgrade),neutral,50.0,2026-04-01T17:40:03.067740
MSFT,Microsoft: Value Investor's Dream,https://seekingalpha.com/article/4887805-microsoft-value-investor-dream?source=feed_symbol_MSFT,"Wed, 01 Apr 2026 10:04:44 -0400",Microsoft: Value Investor's Dream,neutral,50.0,2026-04-01T14:52:46.932324
MSFT,Microsoft: Back To Pre-COVID Multiples - But The Business Has Moved On,https://seekingalpha.com/article/4887334-microsoft-back-to-pre-covid-multiples-but-the-business-has-moved-on?source=feed_symbol_MSFT,"Tue, 31 Mar 2026 05:51:35 -0400",Microsoft: Back To Pre-COVID Multiples - But The Business Has Moved On,neutral,50.0,2026-03-31T12:07:58.549435
MSFT,Microsoft: An Inauspicious Start To 2026,https://seekingalpha.com/article/4887020-microsoft-inauspicious-start-to-2026?source=feed_symbol_MSFT,"Mon, 30 Mar 2026 04:47:55 -0400",Microsoft: An Inauspicious Start To 2026,neutral,50.0,2026-03-30T10:48:20.690580
MSFT,Microsoft: A Compelling Risk To Reward Opportunity,https://seekingalpha.com/article/4886994-microsoft-a-compelling-risk-to-reward-opportunity?source=feed_symbol_MSFT,"Mon, 30 Mar 2026 02:23:25 -0400",Microsoft: A Compelling Risk To Reward Opportunity,neutral,50.0,2026-03-30T10:48:22.338487
MSFT,Microsoft: The Questions That Price Seems To Have Answered,https://seekingalpha.com/article/4886825-microsoft-the-questions-that-price-seems-to-have-answered?source=feed_symbol_MSFT,"Sat, 28 Mar 2026 08:57:29 -0400",Microsoft: The Questions That Price Seems To Have Answered,,0.0,2026-03-28T16:38:21.949632Z
MSFT,"Jefferies notes key takeaways from RSA event after meeting with Microsoft, CrowdStrike execs",https://seekingalpha.com/symbol/MSFT/news?source=feed_symbol_MSFT,"Sat, 28 Mar 2026 08:00:01 -0400","Jefferies notes key takeaways from RSA event after meeting with Microsoft, CrowdStrike execs",,0.0,2026-03-28T16:38:22.196639Z
MSFT,"Microsoft: Fortress Balance Sheet, Deep Value",https://seekingalpha.com/article/4885361-microsoft-fortress-balance-sheet-deep-value?source=feed_symbol_MSFT,"Wed, 25 Mar 2026 08:00:00 -0400","Microsoft: Fortress Balance Sheet, Deep Value",,0.0,2026-03-28T16:38:23.686448Z
