Ticker,Title,URL,Published,Summary,Sentiment,Score,FetchedAt
IBM,International Business Machines Corporation (IBM) Q1 2026 Earnings Call Transcript,https://seekingalpha.com/article/4893115-international-business-machines-corporation-ibm-q1-2026-earnings-call-transcript?source=feed_symbol_IBM,"Wed, 22 Apr 2026 22:10:37 -0400",International Business Machines Corporation (IBM) Q1 2026 Earnings Call Transcript,neutral,50.0,2026-04-23T06:18:56.966214
IBM,International Business Machines Corporation 2026 Q1 - Results - Earnings Call Presentation,https://seekingalpha.com/article/4893142-international-business-machines-corporation-2026-q1-results-earnings-call-presentation?source=feed_symbol_IBM,"Wed, 22 Apr 2026 22:02:21 -0400",International Business Machines Corporation 2026 Q1 - Results - Earnings Call Presentation,neutral,50.0,2026-04-23T06:18:58.548989
IBM,"Earnings Previews: Boeing Still Requires Patience, While IBM's AI Book Is Growing",https://seekingalpha.com/article/4892457-earnings-previews-boeing-requires-patience-ibm-ai-book-growing?source=feed_symbol_IBM,"Tue, 21 Apr 2026 13:06:00 -0400","Earnings Previews: Boeing Still Requires Patience, While IBM's AI Book Is Growing",neutral,50.0,2026-04-21T19:54:33.044399
IBM,IBM: AI Sting,https://seekingalpha.com/article/4888770-ibm-ai-sting?source=feed_symbol_IBM,"Mon, 06 Apr 2026 17:38:16 -0400",IBM: AI Sting,neutral,50.0,2026-04-06T21:53:34.687307
IBM,"IBM: Strong Execution, But Questions Around AI Value Capture",https://seekingalpha.com/article/4888506-ibm-strong-execution-but-questions-around-ai-value-capture?source=feed_symbol_IBM,"Sun, 05 Apr 2026 23:59:00 -0400","IBM: Strong Execution, But Questions Around AI Value Capture",neutral,50.0,2026-04-06T06:21:36.198354
IBM,IBM: The Market Is Overreacting And This Retracement Is Creating An Opportunity,https://seekingalpha.com/article/4887798-ibm-the-market-is-overreacting-and-this-retracement-is-creating-an-opportunity?source=feed_symbol_IBM,"Wed, 01 Apr 2026 09:40:00 -0400",IBM: The Market Is Overreacting And This Retracement Is Creating An Opportunity,neutral,50.0,2026-04-01T14:52:43.327116
IBM,IBM says its quantum computer simulates magnetic materials,https://seekingalpha.com/symbol/IBM/news?source=feed_symbol_IBM,"Thu, 26 Mar 2026 06:40:55 -0400",IBM says its quantum computer simulates magnetic materials,,0.0,2026-03-28T16:38:14.527047Z
IBM,"International Business Machines Corporation (IBM) Presents at Morgan Stanley Technology, Media & Telecom Conference 2026 Transcript",https://seekingalpha.com/article/4879779-international-business-machines-corporation-ibm-presents-at-morgan-stanley-technology-media?source=feed_symbol_IBM,"Sat, 07 Mar 2026 02:05:54 -0500","International Business Machines Corporation (IBM) Presents at Morgan Stanley Technology, Media & Telecom Conference 2026 Transcript",,0.0,2026-03-28T16:38:16.139488Z
IBM,International Business Machines Corporation (IBM) Presents at Bank of America View from the Top CEO Series Transcript,https://seekingalpha.com/article/4882324-international-business-machines-corporation-ibm-presents-at-bank-of-america-view-from-the-top?source=feed_symbol_IBM,"Thu, 05 Mar 2026 21:59:20 -0500",International Business Machines Corporation (IBM) Presents at Bank of America View from the Top CEO Series Transcript,,0.0,2026-03-28T16:38:16.390323Z
IBM,"If IBM Can Drop 13% In A Day, What Does This Say About These Market Conditions?",https://seekingalpha.com/article/4877925-if-ibm-can-drop-13-percent-in-a-day-what-does-this-say-about-these-market-conditions?source=feed_symbol_IBM,"Tue, 03 Mar 2026 18:22:56 -0500","If IBM Can Drop 13% In A Day, What Does This Say About These Market Conditions?",,0.0,2026-03-28T16:38:16.638871Z
IBM,"IBM: AI-Related Selloff In Software Makes Sense, But Not For IBM",https://seekingalpha.com/article/4876816-ibm-ai-related-selloff-in-software-makes-sense-but-not-for-ibm?source=feed_symbol_IBM,"Sun, 01 Mar 2026 09:00:00 -0500","IBM: AI-Related Selloff In Software Makes Sense, But Not For IBM",,0.0,2026-03-28T16:38:16.884340Z
